{
  "arguments" : [
    {
      "name" : "arg",
      "required" : true
    },
    {
      "description" : "argument with help",
      "name" : "arg-with-help",
      "required" : true
    },
    {
      "description" : "argument with default value",
      "name" : "arg-with-default-value",
      "swiftArgumentParserDefaultValue" : "1"
    }
  ],
  "info" : {
    "title" : "a",
    "version" : "1.0.0"
  },
  "opencli" : "0.1",
  "options" : [
    {
      "arguments" : [
        {
          "name" : "enumerated-option",
          "required" : true
        }
      ],
      "name" : "--enumerated-option",
      "recursive" : false,
      "required" : true
    },
    {
      "arguments" : [
        {
          "name" : "enumerated-option-with-default-value",
          "swiftArgumentParserDefaultValue" : "two"
        }
      ],
      "name" : "--enumerated-option-with-default-value",
      "recursive" : false,
      "swiftArgumentParserDefaultValue" : "two"
    },
    {
      "arguments" : [
        {
          "name" : "no-help-option",
          "required" : true
        }
      ],
      "name" : "--no-help-option",
      "recursive" : false,
      "required" : true
    },
    {
      "arguments" : [
        {
          "description" : "int value option",
          "name" : "int-option",
          "required" : true
        }
      ],
      "description" : "int value option",
      "name" : "--int-option",
      "recursive" : false,
      "required" : true
    },
    {
      "arguments" : [
        {
          "description" : "int value option with default value",
          "name" : "int-option-with-default-value",
          "swiftArgumentParserDefaultValue" : "0"
        }
      ],
      "description" : "int value option with default value",
      "name" : "--int-option-with-default-value",
      "recursive" : false,
      "swiftArgumentParserDefaultValue" : "0"
    },
    {
      "aliases" : [
        "--help"
      ],
      "description" : "Show help information.",
      "name" : "-h",
      "recursive" : false
    }
  ]
}