{
  "arguments" : [
    {
      "description" : "Output file path",
      "name" : "output",
      "required" : true
    }
  ],
  "info" : {
    "summary" : "A simple command for testing",
    "title" : "simple",
    "version" : "1.0.0"
  },
  "opencli" : "0.1",
  "options" : [
    {
      "aliases" : [
        "--verbose"
      ],
      "description" : "Show verbose output",
      "name" : "-v",
      "recursive" : false,
      "swiftArgumentParserDefaultValue" : "false"
    },
    {
      "aliases" : [
        "--input"
      ],
      "arguments" : [
        {
          "description" : "Input file path",
          "name" : "input"
        }
      ],
      "description" : "Input file path",
      "name" : "-i",
      "recursive" : false
    },
    {
      "description" : "Show the version.",
      "name" : "--version",
      "recursive" : false
    },
    {
      "aliases" : [
        "--help"
      ],
      "description" : "Show help information.",
      "name" : "-h",
      "recursive" : false
    }
  ]
}